,uniprot_id,Entry,Entry Name,Reviewed,Protein names,Gene Names,Organism,Length,gene_first
354,p62487,P62487,RPB7_HUMAN,reviewed,DNA-directed RNA polymerase II subunit RPB7 (RNA polymerase II subunit B7) (DNA-directed RNA polymerase II subunit G) (RNA polymerase II 19 kDa subunit) (RPB19),POLR2G RPB7,Homo sapiens (Human),172,POLR2G
355,q9nvp2,Q9NVP2,ASF1B_HUMAN,reviewed,Histone chaperone ASF1B (Anti-silencing function protein 1 homolog B) (hAsf1) (hAsf1b) (CCG1-interacting factor A-II) (CIA-II) (hCIA-II),ASF1B,Homo sapiens (Human),202,ASF1B
356,p04908,P04908,H2A1B_HUMAN,reviewed,Histone H2A type 1-B/E (Histone H2A.2) (Histone H2A/a) (Histone H2A/m),H2AC4 H2AFM HIST1H2AB; H2AC8 H2AFA HIST1H2AE,Homo sapiens (Human),130,H2AC4
357,q9ujw3,Q9UJW3,DNM3L_HUMAN,reviewed,DNA (cytosine-5)-methyltransferase 3-like,DNMT3L,Homo sapiens (Human),386,DNMT3L
358,o15530,O15530,PDPK1_HUMAN,reviewed,3-phosphoinositide-dependent protein kinase 1 (hPDK1) (EC 2.7.11.1),PDPK1 PDK1,Homo sapiens (Human),556,PDPK1
359,q9y294,Q9Y294,ASF1A_HUMAN,reviewed,Histone chaperone ASF1A (Anti-silencing function protein 1 homolog A) (hAsf1) (hAsf1a) (CCG1-interacting factor A) (CIA) (hCIA),ASF1A CGI-98 HSPC146,Homo sapiens (Human),204,ASF1A
360,p49642,P49642,PRI1_HUMAN,reviewed,DNA primase small subunit (EC 2.7.7.102) (DNA primase 49 kDa subunit) (p49),PRIM1,Homo sapiens (Human),420,PRIM1
361,p08865,P08865,RSSA_HUMAN,reviewed,Small ribosomal subunit protein uS2 (37 kDa laminin receptor precursor) (37LRP) (37/67 kDa laminin receptor) (LRP/LR) (40S ribosomal protein SA) (67 kDa laminin receptor) (67LR) (Colon carcinoma laminin-binding protein) (Laminin receptor 1) (LamR) (Laminin-binding protein precursor p40) (LBP/p40) (Multidrug resistance-associated protein MGr1-Ag) (NEM/1CHD4),RPSA LAMBR LAMR1,Homo sapiens (Human),295,RPSA
362,p62333,P62333,PRS10_HUMAN,reviewed,26S proteasome regulatory subunit 10B (26S proteasome AAA-ATPase subunit RPT4) (Proteasome 26S subunit ATPase 6) (Proteasome subunit p42),PSMC6 SUG2,Homo sapiens (Human),389,PSMC6
363,o43709,O43709,BUD23_HUMAN,reviewed,18S rRNA (guanine-N(7))-methyltransferase (EC 2.1.1.-) (Bud site selection protein 23 homolog) (Metastasis-related methyltransferase 1) (Williams-Beuren syndrome chromosomal region 22 protein) (rRNA methyltransferase and ribosome maturation factor),BUD23 MERM1 WBSCR22 HUSSY-03 PP3381,Homo sapiens (Human),281,BUD23
364,p63220,P63220,RS21_HUMAN,reviewed,Small ribosomal subunit protein eS21 (40S ribosomal protein S21),RPS21,Homo sapiens (Human),83,RPS21
365,q16531,Q16531,DDB1_HUMAN,reviewed,DNA damage-binding protein 1 (DDB p127 subunit) (DNA damage-binding protein a) (DDBa) (Damage-specific DNA-binding protein 1) (HBV X-associated protein 1) (XAP-1) (UV-damaged DNA-binding factor) (UV-damaged DNA-binding protein 1) (UV-DDB 1) (XPE-binding factor) (XPE-BF) (Xeroderma pigmentosum group E-complementing protein) (XPCe),DDB1 XAP1,Homo sapiens (Human),1140,DDB1
366,q9nsp4,Q9NSP4,CENPM_HUMAN,reviewed,Centromere protein M (CENP-M) (Interphase centromere complex protein 39) (Proliferation-associated nuclear element protein 1),CENPM C22orf18 ICEN39 PANE1,Homo sapiens (Human),180,CENPM
367,q9h9l4,Q9H9L4,KANL2_HUMAN,reviewed,KAT8 regulatory NSL complex subunit 2 (NSL complex protein NSL2) (Non-specific lethal 2 homolog),KANSL2 C12orf41 NSL2,Homo sapiens (Human),492,KANSL2
368,q6zn18,Q6ZN18,AEBP2_HUMAN,reviewed,Zinc finger protein AEBP2 (Adipocyte enhancer-binding protein 2) (AE-binding protein 2),AEBP2,Homo sapiens (Human),517,AEBP2
369,q16594,Q16594,TAF9_HUMAN,reviewed,Transcription initiation factor TFIID subunit 9 (RNA polymerase II TBP-associated factor subunit G) (STAF31/32) (Transcription initiation factor TFIID 31 kDa subunit) (TAFII-31) (TAFII31) (Transcription initiation factor TFIID 32 kDa subunit) (TAFII-32) (TAFII32),TAF9 TAF2G TAFII31,Homo sapiens (Human),264,TAF9
370,q9ugn5,Q9UGN5,PARP2_HUMAN,reviewed,Poly [ADP-ribose] polymerase 2 (PARP-2) (hPARP-2) (EC 2.4.2.30) (ADP-ribosyltransferase diphtheria toxin-like 2) (ARTD2) (DNA ADP-ribosyltransferase PARP2) (EC 2.4.2.-) (NAD(+) ADP-ribosyltransferase 2) (ADPRT-2) (Poly[ADP-ribose] synthase 2) (pADPRT-2) (Protein poly-ADP-ribosyltransferase PARP2) (EC 2.4.2.-),PARP2 ADPRT2 ADPRTL2,Homo sapiens (Human),583,PARP2
371,p61978,P61978,HNRPK_HUMAN,reviewed,Heterogeneous nuclear ribonucleoprotein K (hnRNP K) (Transformation up-regulated nuclear protein) (TUNP),HNRNPK HNRPK,Homo sapiens (Human),463,HNRNPK
372,q9nvc6,Q9NVC6,MED17_HUMAN,reviewed,Mediator of RNA polymerase II transcription subunit 17 (Activator-recruited cofactor 77 kDa component) (ARC77) (Cofactor required for Sp1 transcriptional activation subunit 6) (CRSP complex subunit 6) (Mediator complex subunit 17) (Thyroid hormone receptor-associated protein complex 80 kDa component) (Trap80) (Transcriptional coactivator CRSP77) (Vitamin D3 receptor-interacting protein complex 80 kDa component) (DRIP80),MED17 ARC77 CRSP6 DRIP77 DRIP80 TRAP80,Homo sapiens (Human),651,MED17
373,q92793,Q92793,CBP_HUMAN,reviewed,CREB-binding protein (Histone lysine acetyltransferase CREBBP) (EC 2.3.1.48) (Protein lactyltransferas CREBBP) (EC 2.3.1.-) (Protein-lysine acetyltransferase CREBBP) (EC 2.3.1.-),CREBBP CBP,Homo sapiens (Human),2442,CREBBP
374,q9bs18,Q9BS18,APC13_HUMAN,reviewed,Anaphase-promoting complex subunit 13 (APC13) (Cyclosome subunit 13),ANAPC13,Homo sapiens (Human),74,ANAPC13
375,p41567,P41567,EIF1_HUMAN,reviewed,Eukaryotic translation initiation factor 1 (eIF1) (A121) (Protein translation factor SUI1 homolog) (Sui1iso1),EIF1 SUI1,Homo sapiens (Human),113,EIF1
376,p62875,P62875,RPAB5_HUMAN,reviewed,"DNA-directed RNA polymerases I, II, and III subunit RPABC5 (RNA polymerases I, II, and III subunit ABC5) (DNA-directed RNA polymerase III subunit L) (RNA polymerase II 7.6 kDa subunit) (RPB7.6) (RPB10 homolog)",POLR2L,Homo sapiens (Human),67,POLR2L
377,o15514,O15514,RPB4_HUMAN,reviewed,DNA-directed RNA polymerase II subunit RPB4 (RNA polymerase II subunit B4) (DNA-directed RNA polymerase II subunit D) (RNA polymerase II 16 kDa subunit) (RPB16),POLR2D,Homo sapiens (Human),142,POLR2D
378,p33991,P33991,MCM4_HUMAN,reviewed,DNA replication licensing factor MCM4 (EC 3.6.4.12) (CDC21 homolog) (P1-CDC21),MCM4 CDC21,Homo sapiens (Human),863,MCM4
379,q9byw2,Q9BYW2,SETD2_HUMAN,reviewed,Histone-lysine N-methyltransferase SETD2 (EC 2.1.1.359) (HIF-1) (Huntingtin yeast partner B) (Huntingtin-interacting protein 1) (HIP-1) (Huntingtin-interacting protein B) (Lysine N-methyltransferase 3A) (Protein-lysine N-methyltransferase SETD2) (EC 2.1.1.-) (SET domain-containing protein 2) (hSET2) (p231HBP),SETD2 HIF1 HYPB KIAA1732 KMT3A SET2 HSPC069,Homo sapiens (Human),2564,SETD2
380,q99986,Q99986,VRK1_HUMAN,reviewed,Serine/threonine-protein kinase VRK1 (EC 2.7.11.1) (Vaccinia-related kinase 1),VRK1,Homo sapiens (Human),396,VRK1
381,q9btc0,Q9BTC0,DIDO1_HUMAN,reviewed,Death-inducer obliterator 1 (DIO-1) (hDido1) (Death-associated transcription factor 1) (DATF-1),DIDO1 C20orf158 DATF1 KIAA0333,Homo sapiens (Human),2240,DIDO1
382,p55201,P55201,BRPF1_HUMAN,reviewed,Peregrin (Bromodomain and PHD finger-containing protein 1) (Protein Br140),BRPF1 BR140,Homo sapiens (Human),1214,BRPF1
383,p19447,P19447,ERCC3_HUMAN,reviewed,General transcription and DNA repair factor IIH helicase/translocase subunit XPB (TFIIH subunit XPB) (EC 5.6.2.4) (Basic transcription factor 2 89 kDa subunit) (BTF2 p89) (DNA 3'-5' helicase/translocase XPB) (DNA excision repair protein ERCC-3) (DNA repair protein complementing XP-B cells) (TFIIH basal transcription factor complex 89 kDa subunit) (TFIIH 89 kDa subunit) (TFIIH p89) (Xeroderma pigmentosum group B-complementing protein),ERCC3 XPB XPBC,Homo sapiens (Human),782,ERCC3
384,o75419,O75419,CDC45_HUMAN,reviewed,Cell division control protein 45 homolog (PORC-PI-1),CDC45 CDC45L CDC45L2 UNQ374/PRO710,Homo sapiens (Human),566,CDC45
385,q96ap0,Q96AP0,ACD_HUMAN,reviewed,Adrenocortical dysplasia protein homolog (POT1 and TIN2-interacting protein),ACD PIP1 PTOP TINT1 TPP1,Homo sapiens (Human),458,ACD
386,q9c086,Q9C086,IN80B_HUMAN,reviewed,INO80 complex subunit B (High mobility group AT-hook 1-like 4) (IES2 homolog) (hIes2) (PAP-1-associated protein 1) (PAPA-1) (Zinc finger HIT domain-containing protein 4),INO80B HMGA1L4 PAPA1 ZNHIT4,Homo sapiens (Human),356,INO80B
387,p51965,P51965,UB2E1_HUMAN,reviewed,Ubiquitin-conjugating enzyme E2 E1 (EC 2.3.2.23) ((E3-independent) E2 ubiquitin-conjugating enzyme E1) (EC 2.3.2.24) (E2 ubiquitin-conjugating enzyme E1) (UbcH6) (Ubiquitin carrier protein E1) (Ubiquitin-protein ligase E1),UBE2E1 UBCH6,Homo sapiens (Human),193,UBE2E1
388,q9nr28,Q9NR28,DBLOH_HUMAN,reviewed,"Diablo IAP-binding mitochondrial protein (Diablo homolog, mitochondrial) (Direct IAP-binding protein with low pI) (Second mitochondria-derived activator of caspases) (SMAC) [Cleaved into: Diablo IAP-binding mitochondrial protein, cleaved form]",DIABLO SMAC,Homo sapiens (Human),239,DIABLO
389,q15672,Q15672,TWST1_HUMAN,reviewed,Twist-related protein 1 (Class A basic helix-loop-helix protein 38) (bHLHa38) (H-twist),TWIST1 BHLHA38 TWIST,Homo sapiens (Human),202,TWIST1
390,q9ujx4,Q9UJX4,APC5_HUMAN,reviewed,Anaphase-promoting complex subunit 5 (APC5) (Cyclosome subunit 5),ANAPC5 APC5,Homo sapiens (Human),755,ANAPC5
391,q9uhd9,Q9UHD9,UBQL2_HUMAN,reviewed,Ubiquilin-2 (Chap1) (DSK2 homolog) (Protein linking IAP with cytoskeleton 2) (PLIC-2) (hPLIC-2) (Ubiquitin-like product Chap1/Dsk2),UBQLN2 N4BP4 PLIC2 HRIHFB2157,Homo sapiens (Human),624,UBQLN2
392,p32969,P32969,RL9_HUMAN,reviewed,Large ribosomal subunit protein uL6 (60S ribosomal protein L9),RPL9 OK/SW-cl.103; RPL9P7; RPL9P8; RPL9P9,Homo sapiens (Human),192,RPL9
393,q8n0s6,Q8N0S6,CENPL_HUMAN,reviewed,Centromere protein L (CENP-L) (Interphase centromere complex protein 33),CENPL C1orf155 ICEN33,Homo sapiens (Human),344,CENPL
394,q9y3c7,Q9Y3C7,MED31_HUMAN,reviewed,Mediator of RNA polymerase II transcription subunit 31 (Mediator complex subunit 31) (Mediator complex subunit SOH1) (hSOH1),MED31 SOH1 CGI-125,Homo sapiens (Human),131,MED31
395,p51955,P51955,NEK2_HUMAN,reviewed,Serine/threonine-protein kinase Nek2 (EC 2.7.11.1) (HSPK 21) (Never in mitosis A-related kinase 2) (NimA-related protein kinase 2) (NimA-like protein kinase 1),NEK2 NEK2A NLK1,Homo sapiens (Human),445,NEK2
396,q9bym8,Q9BYM8,HOIL1_HUMAN,reviewed,RanBP-type and C3HC4-type zinc finger-containing protein 1 (EC 2.3.2.31) (HBV-associated factor 4) (Heme-oxidized IRP2 ubiquitin ligase 1) (HOIL-1) (Hepatitis B virus X-associated protein 4) (RING finger protein 54) (RING-type E3 ubiquitin transferase HOIL-1) (Ubiquitin-conjugating enzyme 7-interacting protein 3),RBCK1 C20orf18 RNF54 UBCE7IP3 XAP3 XAP4,Homo sapiens (Human),510,RBCK1
397,q99708,Q99708,CTIP_HUMAN,reviewed,DNA endonuclease RBBP8 (EC 3.1.-.-) (CtBP-interacting protein) (CtIP) (Retinoblastoma-binding protein 8) (RBBP-8) (Retinoblastoma-interacting protein and myosin-like) (RIM) (Sporulation in the absence of SPO11 protein 2 homolog) (SAE2),RBBP8 CTIP,Homo sapiens (Human),897,RBBP8
398,o00255,O00255,MEN1_HUMAN,reviewed,Menin,MEN1 SCG2,Homo sapiens (Human),610,MEN1
399,q00403,Q00403,TF2B_HUMAN,reviewed,Transcription initiation factor IIB (EC 2.3.1.48) (General transcription factor TFIIB) (S300-II),GTF2B TF2B TFIIB,Homo sapiens (Human),316,GTF2B
400,q86wx3,Q86WX3,AROS_HUMAN,reviewed,Active regulator of SIRT1 (40S ribosomal protein S19-binding protein 1) (RPS19-binding protein 1) (S19BP),RPS19BP1 AROS,Homo sapiens (Human),136,RPS19BP1
401,q9y6k9,Q9Y6K9,NEMO_HUMAN,reviewed,NF-kappa-B essential modulator (NEMO) (FIP-3) (IkB kinase-associated protein 1) (IKKAP1) (Inhibitor of nuclear factor kappa-B kinase subunit gamma) (I-kappa-B kinase subunit gamma) (IKK-gamma) (IKKG) (IkB kinase subunit gamma) (NF-kappa-B essential modifier),IKBKG FIP3 NEMO,Homo sapiens (Human),419,IKBKG
402,q96sw2,Q96SW2,CRBN_HUMAN,reviewed,Protein cereblon,CRBN AD-006,Homo sapiens (Human),442,CRBN
403,p59768,P59768,GBG2_HUMAN,reviewed,Guanine nucleotide-binding protein G(I)/G(S)/G(O) subunit gamma-2 (G gamma-I),GNG2,Homo sapiens (Human),71,GNG2
404,g2xkq0,G2XKQ0,SUMO5_HUMAN,reviewed,Small ubiquitin-related modifier 5 (SUMO-5) (SUMO1 pseudogene 1) (Ubiquitin-like 2) (Ubiquitin-like 6),SUMO1P1 SUMO5 UBL2 UBL6,Homo sapiens (Human),101,SUMO1P1
405,q9bs16,Q9BS16,CENPK_HUMAN,reviewed,Centromere protein K (CENP-K) (Interphase centromere complex protein 37) (Protein AF-5alpha) (p33),CENPK ICEN37 FKSG14,Homo sapiens (Human),269,CENPK
406,q9ubq5,Q9UBQ5,EIF3K_HUMAN,reviewed,Eukaryotic translation initiation factor 3 subunit K (eIF3k) (Eukaryotic translation initiation factor 3 subunit 12) (Muscle-specific gene M9 protein) (PLAC-24) (eIF-3 p25) (eIF-3 p28),EIF3K EIF3S12 ARG134 HSPC029 MSTP001 PTD001,Homo sapiens (Human),218,EIF3K
407,p46100,P46100,ATRX_HUMAN,reviewed,Transcriptional regulator ATRX (EC 3.6.4.12) (ATP-dependent helicase ATRX) (X-linked helicase II) (X-linked nuclear protein) (XNP) (Znf-HX),ATRX RAD54L XH2,Homo sapiens (Human),2492,ATRX
408,q9bue0,Q9BUE0,MED18_HUMAN,reviewed,Mediator of RNA polymerase II transcription subunit 18 (Mediator complex subunit 18) (p28b),MED18,Homo sapiens (Human),208,MED18
409,q9y4a5,Q9Y4A5,TRRAP_HUMAN,reviewed,Transformation/transcription domain-associated protein (350/400 kDa PCAF-associated factor) (PAF350/400) (STAF40) (Tra1 homolog),TRRAP PAF400,Homo sapiens (Human),3859,TRRAP
410,q8wub8,Q8WUB8,PHF10_HUMAN,reviewed,PHD finger protein 10 (BRG1-associated factor 45a) (BAF45a) (XAP135),PHF10 BAF45A,Homo sapiens (Human),498,PHF10
411,p61313,P61313,RL15_HUMAN,reviewed,Large ribosomal subunit protein eL15 (60S ribosomal protein L15),RPL15 EC45 TCBAP0781,Homo sapiens (Human),204,RPL15
412,p16402,P16402,H13_HUMAN,reviewed,Histone H1.3 (Histone H1c) (Histone H1s-2),H1-3 H1F3 HIST1H1D,Homo sapiens (Human),221,H1-3
413,q9npj6,Q9NPJ6,MED4_HUMAN,reviewed,Mediator of RNA polymerase II transcription subunit 4 (Activator-recruited cofactor 36 kDa component) (ARC36) (Mediator complex subunit 4) (TRAP/SMCC/PC2 subunit p36 subunit) (Vitamin D3 receptor-interacting protein complex 36 kDa component) (DRIP36),MED4 ARC36 DRIP36 VDRIP HSPC126,Homo sapiens (Human),270,MED4
414,q9y3u8,Q9Y3U8,RL36_HUMAN,reviewed,Large ribosomal subunit protein eL36 (60S ribosomal protein L36),RPL36,Homo sapiens (Human),105,RPL36
415,p62081,P62081,RS7_HUMAN,reviewed,Small ribosomal subunit protein eS7 (40S ribosomal protein S7),RPS7,Homo sapiens (Human),194,RPS7
416,p46782,P46782,RS5_HUMAN,reviewed,"Small ribosomal subunit protein uS7 (40S ribosomal protein S5) [Cleaved into: Small ribosomal subunit protein uS7, N-terminally processed (40S ribosomal protein S5, N-terminally processed)]",RPS5,Homo sapiens (Human),204,RPS5
417,p27695,P27695,APEX1_HUMAN,reviewed,"DNA repair nuclease/redox regulator APEX1 (EC 3.1.11.2) (EC 3.1.21.-) (APEX nuclease) (APEN) (Apurinic-apyrimidinic endonuclease 1) (AP endonuclease 1) (APE-1) (DNA-(apurinic or apyrimidinic site) endonuclease) (Redox factor-1) (REF-1) [Cleaved into: DNA repair nuclease/redox regulator APEX1, mitochondrial]",APEX1 APE APE1 APEX APX HAP1 REF1,Homo sapiens (Human),318,APEX1
418,q6pj21,Q6PJ21,SPSB3_HUMAN,reviewed,SPRY domain-containing SOCS box protein 3 (SSB-3),SPSB3 C16orf31 SSB3,Homo sapiens (Human),355,SPSB3
419,p63165,P63165,SUMO1_HUMAN,reviewed,Small ubiquitin-related modifier 1 (SUMO-1) (GAP-modifying protein 1) (GMP1) (SMT3 homolog 3) (Sentrin) (Ubiquitin-homology domain protein PIC1) (Ubiquitin-like protein SMT3C) (Smt3C) (Ubiquitin-like protein UBL1),SUMO1 SMT3C SMT3H3 UBL1 OK/SW-cl.43,Homo sapiens (Human),101,SUMO1
420,p10412,P10412,H14_HUMAN,reviewed,Histone H1.4 (Histone H1b) (Histone H1s-4),H1-4 H1F4 HIST1H1E,Homo sapiens (Human),219,H1-4
421,p62837,P62837,UB2D2_HUMAN,reviewed,Ubiquitin-conjugating enzyme E2 D2 (EC 2.3.2.23) ((E3-independent) E2 ubiquitin-conjugating enzyme D2) (EC 2.3.2.24) (E2 ubiquitin-conjugating enzyme D2) (Ubiquitin carrier protein D2) (Ubiquitin-conjugating enzyme E2(17)KB 2) (Ubiquitin-conjugating enzyme E2-17 kDa 2) (Ubiquitin-protein ligase D2) (p53-regulated ubiquitin-conjugating enzyme 1),UBE2D2 PUBC1 UBC4 UBC5B UBCH4 UBCH5B,Homo sapiens (Human),147,UBE2D2
422,o95149,O95149,SPN1_HUMAN,reviewed,Snurportin-1 (RNA U transporter 1),SNUPN RNUT1 SPN1,Homo sapiens (Human),360,SNUPN
423,q15369,Q15369,ELOC_HUMAN,reviewed,Elongin-C (EloC) (Elongin 15 kDa subunit) (RNA polymerase II transcription factor SIII subunit C) (SIII p15) (Transcription elongation factor B polypeptide 1),ELOC TCEB1,Homo sapiens (Human),112,ELOC
424,q96ga3,Q96GA3,LTV1_HUMAN,reviewed,Protein LTV1 homolog,LTV1 C6orf93,Homo sapiens (Human),475,LTV1
425,p55317,P55317,FOXA1_HUMAN,reviewed,Hepatocyte nuclear factor 3-alpha (HNF-3-alpha) (HNF-3A) (Forkhead box protein A1) (Transcription factor 3A) (TCF-3A),FOXA1 HNF3A TCF3A,Homo sapiens (Human),472,FOXA1
426,p51946,P51946,CCNH_HUMAN,reviewed,Cyclin-H (MO15-associated protein) (p34) (p37),CCNH,Homo sapiens (Human),323,CCNH
427,q08ag7,Q08AG7,MZT1_HUMAN,reviewed,Mitotic-spindle organizing protein 1 (Mitotic-spindle organizing protein associated with a ring of gamma-tubulin 1),MZT1 C13orf37 MOZART1,Homo sapiens (Human),82,MZT1
428,q70el1,Q70EL1,UBP54_HUMAN,reviewed,Ubiquitin carboxyl-terminal hydrolase 54 (EC 3.4.19.12) (Ubiquitin-specific peptidase 54),USP54 C10orf29,Homo sapiens (Human),1684,USP54
429,p62269,P62269,RS18_HUMAN,reviewed,Small ribosomal subunit protein uS13 (40S ribosomal protein S18) (Ke-3) (Ke3),RPS18 D6S218E,Homo sapiens (Human),152,RPS18
430,q13509,Q13509,TBB3_HUMAN,reviewed,Tubulin beta-3 chain (Tubulin beta-4 chain) (Tubulin beta-III),TUBB3 TUBB4,Homo sapiens (Human),450,TUBB3
431,p62424,P62424,RL7A_HUMAN,reviewed,Large ribosomal subunit protein eL8 (60S ribosomal protein L7a) (PLA-X polypeptide) (Surfeit locus protein 3),RPL7A SURF-3 SURF3,Homo sapiens (Human),266,RPL7A
432,q8n2z9,Q8N2Z9,CENPS_HUMAN,reviewed,Centromere protein S (CENP-S) (Apoptosis-inducing TAF9-like domain-containing protein 1) (FANCM-associated histone fold protein 1) (FANCM-interacting histone fold protein 1) (Fanconi anemia-associated polypeptide of 16 kDa),CENPS APITD1 FAAP16 MHF1,Homo sapiens (Human),138,CENPS
433,q5vwg9,Q5VWG9,TAF3_HUMAN,reviewed,Transcription initiation factor TFIID subunit 3 (140 kDa TATA box-binding protein-associated factor) (TBP-associated factor 3) (Transcription initiation factor TFIID 140 kDa subunit) (TAF(II)140) (TAF140) (TAFII-140) (TAFII140),TAF3,Homo sapiens (Human),929,TAF3
434,p62068,P62068,UBP46_HUMAN,reviewed,Ubiquitin carboxyl-terminal hydrolase 46 (EC 3.4.19.12) (Deubiquitinating enzyme 46) (Ubiquitin thioesterase 46) (Ubiquitin-specific-processing protease 46),USP46,Homo sapiens (Human),366,USP46
435,q16763,Q16763,UBE2S_HUMAN,reviewed,Ubiquitin-conjugating enzyme E2 S (EC 2.3.2.23) (E2 ubiquitin-conjugating enzyme S) (E2-EPF) (Ubiquitin carrier protein S) (Ubiquitin-conjugating enzyme E2-24 kDa) (Ubiquitin-conjugating enzyme E2-EPF5) (Ubiquitin-protein ligase S),UBE2S E2EPF OK/SW-cl.73,Homo sapiens (Human),222,UBE2S
436,p62701,P62701,RS4X_HUMAN,reviewed,"Small ribosomal subunit protein eS4, X isoform (40S ribosomal protein S4) (SCR10) (Single copy abundant mRNA protein)",RPS4X CCG2 RPS4 SCAR,Homo sapiens (Human),263,RPS4X
437,q13347,Q13347,EIF3I_HUMAN,reviewed,Eukaryotic translation initiation factor 3 subunit I (eIF3i) (Eukaryotic translation initiation factor 3 subunit 2) (TGF-beta receptor-interacting protein 1) (TRIP-1) (eIF-3-beta) (eIF3 p36),EIF3I EIF3S2 TRIP1,Homo sapiens (Human),325,EIF3I
438,q99878,Q99878,H2A1J_HUMAN,reviewed,Histone H2A type 1-J (Histone H2A/e),H2AC14 H2AFE HIST1H2AJ,Homo sapiens (Human),128,H2AC14
439,p13639,P13639,EF2_HUMAN,reviewed,Elongation factor 2 (EF-2) (EC 3.6.5.-),EEF2 EF2,Homo sapiens (Human),858,EEF2
440,q08043,Q08043,ACTN3_HUMAN,reviewed,Alpha-actinin-3 (Alpha-actinin skeletal muscle isoform 3) (F-actin cross-linking protein),ACTN3,Homo sapiens (Human),901,ACTN3
441,p46776,P46776,RL27A_HUMAN,reviewed,Large ribosomal subunit protein uL15 (60S ribosomal protein L27a),RPL27A,Homo sapiens (Human),148,RPL27A
442,q6ipu0,Q6IPU0,CENPP_HUMAN,reviewed,Centromere protein P (CENP-P),CENPP,Homo sapiens (Human),288,CENPP
443,p47813,P47813,IF1AX_HUMAN,reviewed,"Eukaryotic translation initiation factor 1A, X-chromosomal (eIF-1A X isoform) (eIF1A X isoform) (Eukaryotic translation initiation factor 4C) (eIF-4C)",EIF1AX EIF1A EIF4C,Homo sapiens (Human),144,EIF1AX
444,o14686,O14686,KMT2D_HUMAN,reviewed,Histone-lysine N-methyltransferase 2D (Lysine N-methyltransferase 2D) (EC 2.1.1.364) (ALL1-related protein) (Myeloid/lymphoid or mixed-lineage leukemia protein 2),KMT2D ALR MLL2 MLL4,Homo sapiens (Human),5537,KMT2D
445,q16778,Q16778,H2B2E_HUMAN,reviewed,Histone H2B type 2-E (H2B-clustered histone 21) (Histone H2B-GL105) (Histone H2B.q) (H2B/q),H2BC21 H2BFQ HIST2H2BE,Homo sapiens (Human),126,H2BC21
446,p49736,P49736,MCM2_HUMAN,reviewed,DNA replication licensing factor MCM2 (EC 3.6.4.12) (Minichromosome maintenance protein 2 homolog) (Nuclear protein BM28),MCM2 BM28 CCNL1 CDCL1 KIAA0030,Homo sapiens (Human),904,MCM2
447,q9bxw9,Q9BXW9,FACD2_HUMAN,reviewed,Fanconi anemia group D2 protein (Protein FACD2),FANCD2 FACD,Homo sapiens (Human),1451,FANCD2
448,q15554,Q15554,TERF2_HUMAN,reviewed,Telomeric repeat-binding factor 2 (TTAGGG repeat-binding factor 2) (Telomeric DNA-binding protein),TERF2 TRBF2 TRF2,Homo sapiens (Human),542,TERF2
449,q92922,Q92922,SMRC1_HUMAN,reviewed,SWI/SNF complex subunit SMARCC1 (BRG1-associated factor 155) (BAF155) (SWI/SNF complex 155 kDa subunit) (SWI/SNF-related matrix-associated actin-dependent regulator of chromatin subfamily C member 1),SMARCC1 BAF155,Homo sapiens (Human),1105,SMARCC1
450,p27635,P27635,RL10_HUMAN,reviewed,Large ribosomal subunit protein uL16 (60S ribosomal protein L10) (Laminin receptor homolog) (Protein QM) (Ribosomal protein L10) (Tumor suppressor QM),RPL10 DXS648E QM,Homo sapiens (Human),214,RPL10
451,q99877,Q99877,H2B1N_HUMAN,reviewed,Histone H2B type 1-N (Histone H2B.d) (H2B/d),H2BC15 H2BFD HIST1H2BN,Homo sapiens (Human),126,H2BC15
452,p61244,P61244,MAX_HUMAN,reviewed,Protein max (Class D basic helix-loop-helix protein 4) (bHLHd4) (Myc-associated factor X),MAX BHLHD4,Homo sapiens (Human),160,MAX
453,q07864,Q07864,DPOE1_HUMAN,reviewed,DNA polymerase epsilon catalytic subunit A (EC 2.7.7.7) (3'-5' exodeoxyribonuclease) (EC 3.1.11.-) (DNA polymerase II subunit A),POLE POLE1,Homo sapiens (Human),2286,POLE
454,q96l50,Q96L50,LLR1_HUMAN,reviewed,Leucine-rich repeat protein 1 (4-1BB-mediated-signaling molecule) (4-1BBlrr) (LRR-repeat protein 1) (LRR-1) (Peptidylprolyl isomerase-like 5),LRR1 PPIL5,Homo sapiens (Human),414,LRR1
455,q9nqr1,Q9NQR1,KMT5A_HUMAN,reviewed,N-lysine methyltransferase KMT5A (EC 2.1.1.-) (H4-K20-HMTase KMT5A) (Histone-lysine N-methyltransferase KMT5A) (EC 2.1.1.361) (Lysine N-methyltransferase 5A) (Lysine-specific methylase 5A) (PR/SET domain-containing protein 07) (PR-Set7) (PR/SET07) (SET domain-containing protein 8),KMT5A PRSET7 SET07 SET8 SETD8,Homo sapiens (Human),393,KMT5A
456,q99728,Q99728,BARD1_HUMAN,reviewed,BRCA1-associated RING domain protein 1 (BARD-1) (EC 2.3.2.27) (RING-type E3 ubiquitin transferase BARD1),BARD1,Homo sapiens (Human),777,BARD1
457,q969g3,Q969G3,SMCE1_HUMAN,reviewed,SWI/SNF-related matrix-associated actin-dependent regulator of chromatin subfamily E member 1 (BRG1-associated factor 57) (BAF57),SMARCE1 BAF57,Homo sapiens (Human),411,SMARCE1
458,q8izd2,Q8IZD2,KMT2E_HUMAN,reviewed,Inactive histone-lysine N-methyltransferase 2E (Inactive lysine N-methyltransferase 2E) (Myeloid/lymphoid or mixed-lineage leukemia protein 5),KMT2E MLL5,Homo sapiens (Human),1858,KMT2E
459,p63173,P63173,RL38_HUMAN,reviewed,Large ribosomal subunit protein eL38 (60S ribosomal protein L38),RPL38,Homo sapiens (Human),70,RPL38
460,q16611,Q16611,BAK_HUMAN,reviewed,Bcl-2 homologous antagonist/killer (Apoptosis regulator BAK) (Bcl-2-like protein 7) (Bcl2-L-7),BAK1 BAK BCL2L7 CDN1,Homo sapiens (Human),211,BAK1
461,q9ns91,Q9NS91,RAD18_HUMAN,reviewed,E3 ubiquitin-protein ligase RAD18 (EC 2.3.2.27) (Postreplication repair protein RAD18) (hHR18) (hRAD18) (RING finger protein 73) (RING-type E3 ubiquitin transferase RAD18),RAD18 RNF73,Homo sapiens (Human),495,RAD18
462,p51668,P51668,UB2D1_HUMAN,reviewed,Ubiquitin-conjugating enzyme E2 D1 (EC 2.3.2.23) ((E3-independent) E2 ubiquitin-conjugating enzyme D1) (EC 2.3.2.24) (E2 ubiquitin-conjugating enzyme D1) (Stimulator of Fe transport) (SFT) (UBC4/5 homolog) (UbcH5) (Ubiquitin carrier protein D1) (Ubiquitin-conjugating enzyme E2(17)KB 1) (Ubiquitin-conjugating enzyme E2-17 kDa 1) (Ubiquitin-protein ligase D1),UBE2D1 SFT UBC5A UBCH5 UBCH5A,Homo sapiens (Human),147,UBE2D1
463,p60484,P60484,PTEN_HUMAN,reviewed,"Phosphatidylinositol 3,4,5-trisphosphate 3-phosphatase and dual-specificity protein phosphatase PTEN (EC 3.1.3.16) (EC 3.1.3.48) (EC 3.1.3.67) (Inositol polyphosphate 3-phosphatase) (EC 3.1.3.-) (Mutated in multiple advanced cancers 1) (Phosphatase and tensin homolog)",PTEN MMAC1 TEP1,Homo sapiens (Human),403,PTEN
464,q92794,Q92794,KAT6A_HUMAN,reviewed,"Histone acetyltransferase KAT6A (EC 2.3.1.48) (MOZ, YBF2/SAS3, SAS2 and TIP60 protein 3) (MYST-3) (Monocytic leukemia zinc finger protein) (Runt-related transcription factor-binding protein 2) (Zinc finger protein 220)",KAT6A MOZ MYST3 RUNXBP2 ZNF220,Homo sapiens (Human),2004,KAT6A
465,q13895,Q13895,BYST_HUMAN,reviewed,Bystin,BYSL ENP1,Homo sapiens (Human),437,BYSL
466,q15004,Q15004,PAF15_HUMAN,reviewed,PCNA-associated factor (Hepatitis C virus NS5A-transactivated protein 9) (HCV NS5A-transactivated protein 9) (Overexpressed in anaplastic thyroid carcinoma 1) (OEATC-1) (PCNA-associated factor of 15 kDa) (PAF15) (p15PAF) (PCNA-clamp-associated factor),PCLAF KIAA0101 NS5ATP9 PAF L5,Homo sapiens (Human),111,PCLAF
