,uniprot_id,Entry,Entry Name,Reviewed,Protein names,Gene Names,Organism,Length,gene_first
467,q04206,Q04206,TF65_HUMAN,reviewed,Transcription factor p65 (Nuclear factor NF-kappa-B p65 subunit) (Nuclear factor of kappa light polypeptide gene enhancer in B-cells 3),RELA NFKB3,Homo sapiens (Human),551,RELA
468,p14859,P14859,PO2F1_HUMAN,reviewed,"POU domain, class 2, transcription factor 1 (NF-A1) (Octamer-binding protein 1) (Oct-1) (Octamer-binding transcription factor 1) (OTF-1)",POU2F1 OCT1 OTF1,Homo sapiens (Human),743,POU2F1
469,q9p275,Q9P275,UBP36_HUMAN,reviewed,Ubiquitin carboxyl-terminal hydrolase 36 (EC 2.3.2.-) (EC 3.4.19.12) (Deubiquitinating enzyme 36) (Ubiquitin thioesterase 36) (Ubiquitin-specific-processing protease 36),USP36 KIAA1453,Homo sapiens (Human),1123,USP36
470,q9ujq4,Q9UJQ4,SALL4_HUMAN,reviewed,Sal-like protein 4 (Zinc finger protein 797) (Zinc finger protein SALL4),SALL4 ZNF797,Homo sapiens (Human),1053,SALL4
471,q99832,Q99832,TCPH_HUMAN,reviewed,"T-complex protein 1 subunit eta (TCP-1-eta) (EC 3.6.1.-) (CCT-eta) (Chaperonin containing T-complex polypeptide 1 subunit 7) (HIV-1 Nef-interacting protein) [Cleaved into: T-complex protein 1 subunit eta, N-terminally processed]",CCT7 CCTH NIP7-1,Homo sapiens (Human),543,CCT7
472,q9upp1,Q9UPP1,PHF8_HUMAN,reviewed,Histone lysine demethylase PHF8 (EC 1.14.11.27) (EC 1.14.11.65) (PHD finger protein 8) ([histone H3]-dimethyl-L-lysine(36) demethylase PHF8) ([histone H3]-dimethyl-L-lysine(9) demethylase PHF8),PHF8 KIAA1111 ZNF422,Homo sapiens (Human),1060,PHF8
473,p61086,P61086,UBE2K_HUMAN,reviewed,Ubiquitin-conjugating enzyme E2 K (EC 2.3.2.23) (E2 ubiquitin-conjugating enzyme K) (Huntingtin-interacting protein 2) (HIP-2) (Ubiquitin carrier protein) (Ubiquitin-conjugating enzyme E2-25 kDa) (Ubiquitin-conjugating enzyme E2(25K)) (Ubiquitin-conjugating enzyme E2-25K) (Ubiquitin-protein ligase),UBE2K HIP2 LIG,Homo sapiens (Human),200,UBE2K
474,q8iws0,Q8IWS0,PHF6_HUMAN,reviewed,PHD finger protein 6 (PHD-like zinc finger protein),PHF6 CENP-31 KIAA1823,Homo sapiens (Human),365,PHF6
475,q14566,Q14566,MCM6_HUMAN,reviewed,DNA replication licensing factor MCM6 (EC 3.6.4.12) (p105MCM),MCM6,Homo sapiens (Human),821,MCM6
476,p62891,P62891,RL39_HUMAN,reviewed,Large ribosomal subunit protein eL39 (60S ribosomal protein L39),RPL39,Homo sapiens (Human),51,RPL39
477,q9gzn1,Q9GZN1,ARP6_HUMAN,reviewed,Actin-related protein 6 (hArp6) (hARPX),ACTR6 CDA12,Homo sapiens (Human),396,ACTR6
478,q86x55,Q86X55,CARM1_HUMAN,reviewed,Histone-arginine methyltransferase CARM1 (EC 2.1.1.319) (Coactivator-associated arginine methyltransferase 1) (Protein arginine N-methyltransferase 4),CARM1 PRMT4,Homo sapiens (Human),608,CARM1
479,q07912,Q07912,ACK1_HUMAN,reviewed,Activated CDC42 kinase 1 (ACK-1) (EC 2.7.10.2) (EC 2.7.11.1) (Tyrosine kinase non-receptor protein 2),TNK2 ACK1,Homo sapiens (Human),1038,TNK2
480,q9byx4,Q9BYX4,IFIH1_HUMAN,reviewed,Interferon-induced helicase C domain-containing protein 1 (EC 3.6.4.13) (Clinically amyopathic dermatomyositis autoantigen 140 kDa) (CADM-140 autoantigen) (Helicase with 2 CARD domains) (Helicard) (Interferon-induced with helicase C domain protein 1) (Melanoma differentiation-associated protein 5) (MDA-5) (Murabutide down-regulated protein) (RIG-I-like receptor 2) (RLR-2) (RNA helicase-DEAD box protein 116),IFIH1 MDA5 RH116,Homo sapiens (Human),1025,IFIH1
481,q70cq2,Q70CQ2,UBP34_HUMAN,reviewed,Ubiquitin carboxyl-terminal hydrolase 34 (EC 3.4.19.12) (Deubiquitinating enzyme 34) (Ubiquitin thioesterase 34) (Ubiquitin-specific-processing protease 34),USP34 KIAA0570 KIAA0729,Homo sapiens (Human),3546,USP34
482,q71sy5,Q71SY5,MED25_HUMAN,reviewed,Mediator of RNA polymerase II transcription subunit 25 (Activator interaction domain-containing protein 1) (Activator-recruited cofactor 92 kDa component) (ARC92) (Mediator complex subunit 25) (p78),MED25 ACID1 ARC92 PTOV2 TCBAP0758,Homo sapiens (Human),747,MED25
483,q5tec6,Q5TEC6,H37_HUMAN,reviewed,Histone H3-7,H3-7 H3-2 HIST2H3PS2,Homo sapiens (Human),136,H3-7
484,q8wxe1,Q8WXE1,ATRIP_HUMAN,reviewed,ATR-interacting protein (ATM and Rad3-related-interacting protein),ATRIP AGS1,Homo sapiens (Human),791,ATRIP
485,q4fzb7,Q4FZB7,KMT5B_HUMAN,reviewed,Histone-lysine N-methyltransferase KMT5B (Lysine N-methyltransferase 5B) (Lysine-specific methyltransferase 5B) (Suppressor of variegation 4-20 homolog 1) (Su(var)4-20 homolog 1) (Suv4-20h1) ([histone H4]-N-methyl-L-lysine20 N-methyltransferase KMT5B) (EC 2.1.1.362) ([histone H4]-lysine20 N-methyltransferase KMT5B) (EC 2.1.1.361),KMT5B SUV420H1 CGI-85,Homo sapiens (Human),885,KMT5B
486,o60566,O60566,BUB1B_HUMAN,reviewed,Mitotic checkpoint serine/threonine-protein kinase BUB1 beta (EC 2.7.11.1) (MAD3/BUB1-related protein kinase) (hBUBR1) (Mitotic checkpoint kinase MAD3L) (Protein SSK1),BUB1B BUBR1 MAD3L SSK1,Homo sapiens (Human),1050,BUB1B
487,q16384,Q16384,SSX1_HUMAN,reviewed,"Protein SSX1 (Cancer/testis antigen 5.1) (CT5.1) (Synovial sarcoma, X breakpoint 1)",SSX1,Homo sapiens (Human),188,SSX1
488,p53803,P53803,RPAB4_HUMAN,reviewed,"DNA-directed RNA polymerases I, II, and III subunit RPABC4 (RNA polymerases I, II, and III subunit ABC4) (ABC10-alpha) (DNA-directed RNA polymerase II subunit K) (RNA polymerase II 7.0 kDa subunit) (RPB7.0) (RPB10alpha)",POLR2K,Homo sapiens (Human),58,POLR2K
489,q5ta45,Q5TA45,INT11_HUMAN,reviewed,Integrator complex subunit 11 (Int11) (EC 3.1.27.-) (Cleavage and polyadenylation-specific factor 3-like protein) (CPSF3-like protein) (Protein related to CPSF subunits of 68 kDa) (RC-68),INTS11 CPSF3L RC68,Homo sapiens (Human),600,INTS11
490,p62899,P62899,RL31_HUMAN,reviewed,Large ribosomal subunit protein eL31 (60S ribosomal protein L31),RPL31,Homo sapiens (Human),125,RPL31
491,q96hr3,Q96HR3,MED30_HUMAN,reviewed,Mediator of RNA polymerase II transcription subunit 30 (Mediator complex subunit 30) (TRAP/Mediator complex component TRAP25) (Thyroid hormone receptor-associated protein 6) (Thyroid hormone receptor-associated protein complex 25 kDa component) (Trap25),MED30 THRAP6 TRAP25,Homo sapiens (Human),178,MED30
492,q9h2j4,Q9H2J4,PDCL3_HUMAN,reviewed,Phosducin-like protein 3 (HTPHLP) (PhPL3) (Viral IAP-associated factor 1) (VIAF-1),PDCL3 PhLP2A VIAF1,Homo sapiens (Human),239,PDCL3
493,q15542,Q15542,TAF5_HUMAN,reviewed,Transcription initiation factor TFIID subunit 5 (Transcription initiation factor TFIID 100 kDa subunit) (TAF(II)100) (TAFII-100) (TAFII100),TAF5 TAF2D,Homo sapiens (Human),800,TAF5
494,p55884,P55884,EIF3B_HUMAN,reviewed,Eukaryotic translation initiation factor 3 subunit B (eIF3b) (Eukaryotic translation initiation factor 3 subunit 9) (Prt1 homolog) (hPrt1) (eIF-3-eta) (eIF3 p110) (eIF3 p116),EIF3B EIF3S9,Homo sapiens (Human),814,EIF3B
495,p61254,P61254,RL26_HUMAN,reviewed,Large ribosomal subunit protein uL24 (60S ribosomal protein L26),RPL26,Homo sapiens (Human),145,RPL26
496,p06899,P06899,H2B1J_HUMAN,reviewed,Histone H2B type 1-J (Histone H2B.1) (Histone H2B.r) (H2B/r),H2BC11 H2BFR HIST1H2BJ,Homo sapiens (Human),126,H2BC11
497,q9c005,Q9C005,DPY30_HUMAN,reviewed,Protein dpy-30 homolog (Dpy-30-like protein) (Dpy-30L),DPY30,Homo sapiens (Human),99,DPY30
498,q9nrx1,Q9NRX1,PNO1_HUMAN,reviewed,RNA-binding protein PNO1 (Partner of NOB1),PNO1,Homo sapiens (Human),252,PNO1
499,o95863,O95863,SNAI1_HUMAN,reviewed,Zinc finger protein SNAI1 (Protein snail homolog 1) (Protein sna),SNAI1 SNAH,Homo sapiens (Human),264,SNAI1
500,q96fw1,Q96FW1,OTUB1_HUMAN,reviewed,Ubiquitin thioesterase OTUB1 (EC 3.4.19.12) (Deubiquitinating enzyme OTUB1) (OTU domain-containing ubiquitin aldehyde-binding protein 1) (Otubain-1) (hOTU1) (Ubiquitin-specific-processing protease OTUB1),OTUB1 OTB1 OTU1 HSPC263,Homo sapiens (Human),271,OTUB1
501,o00267,O00267,SPT5H_HUMAN,reviewed,Transcription elongation factor SPT5 (hSPT5) (DRB sensitivity-inducing factor 160 kDa subunit) (DSIF p160) (DRB sensitivity-inducing factor large subunit) (DSIF large subunit) (Tat-cotransactivator 1 protein) (Tat-CT1 protein),SUPT5H SPT5 SPT5H,Homo sapiens (Human),1087,SUPT5H
502,q53hl2,Q53HL2,BOREA_HUMAN,reviewed,Borealin (Cell division cycle-associated protein 8) (Dasra-B) (hDasra-B) (Pluripotent embryonic stem cell-related gene 3 protein),CDCA8 PESCRG3,Homo sapiens (Human),280,CDCA8
503,o75586,O75586,MED6_HUMAN,reviewed,Mediator of RNA polymerase II transcription subunit 6 (Activator-recruited cofactor 33 kDa component) (ARC33) (Mediator complex subunit 6) (hMed6) (Renal carcinoma antigen NY-REN-28),MED6 ARC33,Homo sapiens (Human),246,MED6
504,q8nhz8,Q8NHZ8,CDC26_HUMAN,reviewed,Anaphase-promoting complex subunit CDC26 (Anaphase-promoting complex subunit 12) (APC12) (Cell division cycle protein 26 homolog),CDC26 ANAPC12 C9orf17,Homo sapiens (Human),85,CDC26
505,p35716,P35716,SOX11_HUMAN,reviewed,Transcription factor SOX-11,SOX11,Homo sapiens (Human),441,SOX11
506,p27694,P27694,RFA1_HUMAN,reviewed,"Replication protein A 70 kDa DNA-binding subunit (RP-A p70) (Replication factor A protein 1) (RF-A protein 1) (Single-stranded DNA-binding protein) [Cleaved into: Replication protein A 70 kDa DNA-binding subunit, N-terminally processed]",RPA1 REPA1 RPA70,Homo sapiens (Human),616,RPA1
507,p83881,P83881,RL36A_HUMAN,reviewed,Large ribosomal subunit protein eL42 (60S ribosomal protein L36a) (60S ribosomal protein L44) (Cell growth-inhibiting gene 15 protein) (Cell migration-inducing gene 6 protein),RPL36A RPL44 GIG15 MIG6,Homo sapiens (Human),106,RPL36A
508,q14839,Q14839,CHD4_HUMAN,reviewed,Chromodomain-helicase-DNA-binding protein 4 (CHD-4) (EC 3.6.4.-) (ATP-dependent helicase CHD4) (Mi-2 autoantigen 218 kDa protein) (Mi2-beta),CHD4,Homo sapiens (Human),1912,CHD4
509,o60260,O60260,PRKN_HUMAN,reviewed,E3 ubiquitin-protein ligase parkin (Parkin) (EC 2.3.2.31) (Parkin RBR E3 ubiquitin-protein ligase) (Parkinson juvenile disease protein 2) (Parkinson disease protein 2),PRKN PARK2,Homo sapiens (Human),465,PRKN
510,o15550,O15550,KDM6A_HUMAN,reviewed,Lysine-specific demethylase 6A (EC 1.14.11.68) (Histone demethylase UTX) (Ubiquitously-transcribed TPR protein on the X chromosome) (Ubiquitously-transcribed X chromosome tetratricopeptide repeat protein) ([histone H3]-trimethyl-L-lysine(27) demethylase 6A),KDM6A UTX,Homo sapiens (Human),1401,KDM6A
511,q96gm5,Q96GM5,SMRD1_HUMAN,reviewed,SWI/SNF-related matrix-associated actin-dependent regulator of chromatin subfamily D member 1 (60 kDa BRG-1/Brm-associated factor subunit A) (BRG1-associated factor 60A) (BAF60A) (SWI/SNF complex 60 kDa subunit),SMARCD1 BAF60A,Homo sapiens (Human),515,SMARCD1
512,p48729,P48729,KC1A_HUMAN,reviewed,Casein kinase I isoform alpha (CKI-alpha) (EC 2.7.11.1) (CK1),CSNK1A1,Homo sapiens (Human),337,CSNK1A1
513,p83916,P83916,CBX1_HUMAN,reviewed,Chromobox protein homolog 1 (HP1Hsbeta) (Heterochromatin protein 1 homolog beta) (HP1 beta) (Heterochromatin protein p25) (M31) (Modifier 1 protein) (p25beta),CBX1 CBX,Homo sapiens (Human),185,CBX1
514,q9uq80,Q9UQ80,PA2G4_HUMAN,reviewed,Proliferation-associated protein 2G4 (Cell cycle protein p38-2G4 homolog) (hG4-1) (ErbB3-binding protein 1),PA2G4 EBP1,Homo sapiens (Human),394,PA2G4
515,p67775,P67775,PP2AA_HUMAN,reviewed,Serine/threonine-protein phosphatase 2A catalytic subunit alpha isoform (PP2A-alpha) (EC 3.1.3.16) (Replication protein C) (RP-C),PPP2CA,Homo sapiens (Human),309,PPP2CA
516,o95619,O95619,YETS4_HUMAN,reviewed,YEATS domain-containing protein 4 (Glioma-amplified sequence 41) (Gas41) (NuMA-binding protein 1) (NuBI-1) (NuBI1),YEATS4 GAS41,Homo sapiens (Human),227,YEATS4
517,q71ui9,Q71UI9,H2AV_HUMAN,reviewed,Histone H2A.V (H2A.F/Z) (H2A.Z variant histone 2),H2AZ2 H2AFV H2AV,Homo sapiens (Human),128,H2AZ2
518,q86vp1,Q86VP1,TAXB1_HUMAN,reviewed,Tax1-binding protein 1 (TRAF6-binding protein),TAX1BP1 T6BP PRO0105,Homo sapiens (Human),789,TAX1BP1
519,o75475,O75475,PSIP1_HUMAN,reviewed,PC4 and SFRS1-interacting protein (CLL-associated antigen KW-7) (Dense fine speckles 70 kDa protein) (DFS 70) (Lens epithelium-derived growth factor) (Transcriptional coactivator p75/p52),PSIP1 DFS70 LEDGF PSIP2,Homo sapiens (Human),530,PSIP1
520,o14744,O14744,ANM5_HUMAN,reviewed,"Protein arginine N-methyltransferase 5 (PRMT5) (EC 2.1.1.320) (72 kDa ICln-binding protein) (Histone-arginine N-methyltransferase PRMT5) (Jak-binding protein 1) (Shk1 kinase-binding protein 1 homolog) (SKB1 homolog) (SKB1Hs) [Cleaved into: Protein arginine N-methyltransferase 5, N-terminally processed]",PRMT5 HRMT1L5 IBP72 JBP1 SKB1,Homo sapiens (Human),637,PRMT5
521,p48431,P48431,SOX2_HUMAN,reviewed,Transcription factor SOX-2,SOX2,Homo sapiens (Human),317,SOX2
522,p62888,P62888,RL30_HUMAN,reviewed,Large ribosomal subunit protein eL30 (60S ribosomal protein L30),RPL30,Homo sapiens (Human),115,RPL30
523,q9npf5,Q9NPF5,DMAP1_HUMAN,reviewed,DNA methyltransferase 1-associated protein 1 (DNMAP1) (DNMT1-associated protein 1),DMAP1 KIAA1425,Homo sapiens (Human),467,DMAP1
524,q96ha7,Q96HA7,TONSL_HUMAN,reviewed,Tonsoku-like protein (Inhibitor of kappa B-related protein) (I-kappa-B-related protein) (IkappaBR) (NF-kappa-B inhibitor-like protein 2) (Nuclear factor of kappa light polypeptide gene enhancer in B-cells inhibitor-like 2),TONSL IKBR NFKBIL2,Homo sapiens (Human),1378,TONSL
525,o15371,O15371,EIF3D_HUMAN,reviewed,Eukaryotic translation initiation factor 3 subunit D (eIF3d) (Eukaryotic translation initiation factor 3 subunit 7) (eIF-3-zeta) (eIF3 p66),EIF3D EIF3S7,Homo sapiens (Human),548,EIF3D
526,q6pi98,Q6PI98,IN80C_HUMAN,reviewed,INO80 complex subunit C (IES6 homolog) (hIes6),INO80C C18orf37,Homo sapiens (Human),192,INO80C
527,o15016,O15016,TRI66_HUMAN,reviewed,Tripartite motif-containing protein 66,TRIM66 C11orf29 KIAA0298,Homo sapiens (Human),1351,TRIM66
528,q9y6k1,Q9Y6K1,DNM3A_HUMAN,reviewed,DNA (cytosine-5)-methyltransferase 3A (Dnmt3a) (EC 2.1.1.37) (Cysteine methyltransferase DNMT3A) (EC 2.1.1.-) (DNA methyltransferase HsaIIIA) (DNA MTase HsaIIIA) (M.HsaIIIA),DNMT3A,Homo sapiens (Human),912,DNMT3A
529,q92560,Q92560,BAP1_HUMAN,reviewed,Ubiquitin carboxyl-terminal hydrolase BAP1 (EC 3.4.19.12) (BRCA1-associated protein 1) (Cerebral protein 6),BAP1 KIAA0272 hucep-6,Homo sapiens (Human),729,BAP1
530,p62263,P62263,RS14_HUMAN,reviewed,Small ribosomal subunit protein uS11 (40S ribosomal protein S14),RPS14 PRO2640,Homo sapiens (Human),151,RPS14
531,q9nrg4,Q9NRG4,SMYD2_HUMAN,reviewed,N-lysine methyltransferase SMYD2 (EC 2.1.1.-) (HSKM-B) (Histone methyltransferase SMYD2) (EC 2.1.1.354) (Lysine N-methyltransferase 3C) (SET and MYND domain-containing protein 2),SMYD2 KMT3C,Homo sapiens (Human),433,SMYD2
532,o75530,O75530,EED_HUMAN,reviewed,Polycomb protein EED (hEED) (Embryonic ectoderm development protein) (WD protein associating with integrin cytoplasmic tails 1) (WAIT-1),EED,Homo sapiens (Human),441,EED
533,q96hw7,Q96HW7,INT4_HUMAN,reviewed,Integrator complex subunit 4 (Int4),INTS4 MSTP093,Homo sapiens (Human),963,INTS4
534,q06609,Q06609,RAD51_HUMAN,reviewed,DNA repair protein RAD51 homolog 1 (HsRAD51) (hRAD51) (RAD51 homolog A),RAD51 RAD51A RECA,Homo sapiens (Human),339,RAD51
535,q6w2j9,Q6W2J9,BCOR_HUMAN,reviewed,BCL-6 corepressor (BCoR),BCOR KIAA1575,Homo sapiens (Human),1755,BCOR
536,p52434,P52434,RPAB3_HUMAN,reviewed,"DNA-directed RNA polymerases I, II, and III subunit RPABC3 (RNA polymerases I, II, and III subunit ABC3) (DNA-directed RNA polymerase II subunit H) (DNA-directed RNA polymerases I, II, and III 17.1 kDa polypeptide) (RPB17) (RPB8 homolog) (hRPB8)",POLR2H,Homo sapiens (Human),150,POLR2H
537,p25786,P25786,PSA1_HUMAN,reviewed,Proteasome subunit alpha type-1 (30 kDa prosomal protein) (PROS-30) (Macropain subunit C2) (Multicatalytic endopeptidase complex subunit C2) (Proteasome component C2) (Proteasome nu chain) (Proteasome subunit alpha-6) (alpha-6),PSMA1 HC2 NU PROS30 PSC2,Homo sapiens (Human),263,PSMA1
538,p49721,P49721,PSB2_HUMAN,reviewed,Proteasome subunit beta type-2 (Macropain subunit C7-I) (Multicatalytic endopeptidase complex subunit C7-I) (Proteasome component C7-I) (Proteasome subunit beta-4) (beta-4),PSMB2,Homo sapiens (Human),201,PSMB2
539,o00762,O00762,UBE2C_HUMAN,reviewed,Ubiquitin-conjugating enzyme E2 C (EC 2.3.2.23) ((E3-independent) E2 ubiquitin-conjugating enzyme C) (EC 2.3.2.24) (E2 ubiquitin-conjugating enzyme C) (UbcH10) (Ubiquitin carrier protein C) (Ubiquitin-protein ligase C),UBE2C UBCH10,Homo sapiens (Human),179,UBE2C
540,q8taq2,Q8TAQ2,SMRC2_HUMAN,reviewed,SWI/SNF complex subunit SMARCC2 (BRG1-associated factor 170) (BAF170) (SWI/SNF complex 170 kDa subunit) (SWI/SNF-related matrix-associated actin-dependent regulator of chromatin subfamily C member 2),SMARCC2 BAF170,Homo sapiens (Human),1214,SMARCC2
541,q92759,Q92759,TF2H4_HUMAN,reviewed,General transcription factor IIH subunit 4 (Basic transcription factor 2 52 kDa subunit) (BTF2 p52) (General transcription factor IIH polypeptide 4) (TFIIH basal transcription factor complex p52 subunit),GTF2H4,Homo sapiens (Human),462,GTF2H4
542,q92833,Q92833,JARD2_HUMAN,reviewed,Protein Jumonji (Jumonji/ARID domain-containing protein 2),JARID2 JMJ,Homo sapiens (Human),1246,JARID2
543,o15020,O15020,SPTN2_HUMAN,reviewed,"Spectrin beta chain, non-erythrocytic 2 (Beta-III spectrin) (Spinocerebellar ataxia 5 protein)",SPTBN2 KIAA0302 SCA5,Homo sapiens (Human),2390,SPTBN2
544,q9h3p2,Q9H3P2,NELFA_HUMAN,reviewed,Negative elongation factor A (NELF-A) (Wolf-Hirschhorn syndrome candidate 2 protein),NELFA WHSC2 P/OKcl.15,Homo sapiens (Human),528,NELFA
545,p41091,P41091,IF2G_HUMAN,reviewed,Eukaryotic translation initiation factor 2 subunit 3 (EC 3.6.5.3) (Eukaryotic translation initiation factor 2 subunit gamma X) (eIF2-gamma X) (eIF2gX),EIF2S3 EIF2G,Homo sapiens (Human),472,EIF2S3
546,q9y5n1,Q9Y5N1,HRH3_HUMAN,reviewed,Histamine H3 receptor (H3R) (HH3R) (G-protein coupled receptor 97),HRH3 GPCR97,Homo sapiens (Human),445,HRH3
547,p21675,P21675,TAF1_HUMAN,reviewed,Transcription initiation factor TFIID subunit 1 (EC 2.3.1.48) (EC 2.7.11.1) (Cell cycle gene 1 protein) (TBP-associated factor 250 kDa) (p250) (Transcription initiation factor TFIID 250 kDa subunit) (TAF(II)250) (TAFII-250) (TAFII250),TAF1 BA2R CCG1 CCGS TAF2A,Homo sapiens (Human),1893,TAF1
548,q7z4v5,Q7Z4V5,HDGR2_HUMAN,reviewed,Hepatoma-derived growth factor-related protein 2 (HDGF-related protein 2) (HRP-2) (Hepatoma-derived growth factor 2) (HDGF-2),HDGFL2 HDGF2 HDGFRP2 HRP2 UNQ785/PRO1604,Homo sapiens (Human),671,HDGFL2
549,p61513,P61513,RL37A_HUMAN,reviewed,Large ribosomal subunit protein eL43 (60S ribosomal protein L37a),RPL37A,Homo sapiens (Human),92,RPL37A
550,q13315,Q13315,ATM_HUMAN,reviewed,Serine-protein kinase ATM (EC 2.7.11.1) (Ataxia telangiectasia mutated) (A-T mutated),ATM,Homo sapiens (Human),3056,ATM
551,q86y26,Q86Y26,NUTM1_HUMAN,reviewed,NUT family member 1 (Nuclear protein in testis),NUTM1 C15orf55 NUT,Homo sapiens (Human),1132,NUTM1
552,p33993,P33993,MCM7_HUMAN,reviewed,DNA replication licensing factor MCM7 (EC 3.6.4.12) (CDC47 homolog) (P1.1-MCM3),MCM7 CDC47 MCM2,Homo sapiens (Human),719,MCM7
553,q15545,Q15545,TAF7_HUMAN,reviewed,Transcription initiation factor TFIID subunit 7 (RNA polymerase II TBP-associated factor subunit F) (Transcription initiation factor TFIID 55 kDa subunit) (TAF(II)55) (TAFII-55) (TAFII55),TAF7 TAF2F TAFII55,Homo sapiens (Human),349,TAF7
554,p10412,P10412,H14_HUMAN,reviewed,Histone H1.4 (Histone H1b) (Histone H1s-4),H1-4 H1F4 HIST1H1E,Homo sapiens (Human),219,H1-4
555,o43242,O43242,PSMD3_HUMAN,reviewed,26S proteasome non-ATPase regulatory subunit 3 (26S proteasome regulatory subunit RPN3) (26S proteasome regulatory subunit S3) (Proteasome subunit p58),PSMD3,Homo sapiens (Human),534,PSMD3
556,q6b0i6,Q6B0I6,KDM4D_HUMAN,reviewed,Lysine-specific demethylase 4D (EC 1.14.11.66) (JmjC domain-containing histone demethylation protein 3D) (Jumonji domain-containing protein 2D) ([histone H3]-trimethyl-L-lysine(9) demethylase 4D),KDM4D JHDM3D JMJD2D,Homo sapiens (Human),523,KDM4D
557,p49427,P49427,UB2R1_HUMAN,reviewed,Ubiquitin-conjugating enzyme E2 R1 (EC 2.3.2.23) ((E3-independent) E2 ubiquitin-conjugating enzyme R1) (EC 2.3.2.24) (E2 ubiquitin-conjugating enzyme R1) (Ubiquitin-conjugating enzyme E2-32 kDa complementing) (Ubiquitin-conjugating enzyme E2-CDC34) (Ubiquitin-protein ligase R1),CDC34 UBCH3 UBE2R1,Homo sapiens (Human),236,CDC34
558,p15374,P15374,UCHL3_HUMAN,reviewed,Ubiquitin carboxyl-terminal hydrolase isozyme L3 (UCH-L3) (EC 3.4.19.12) (Ubiquitin thioesterase L3),UCHL3,Homo sapiens (Human),230,UCHL3
559,q02078,Q02078,MEF2A_HUMAN,reviewed,Myocyte-specific enhancer factor 2A (Serum response factor-like protein 1),MEF2A MEF2,Homo sapiens (Human),507,MEF2A
560,q71di3,Q71DI3,H32_HUMAN,reviewed,Histone H3.2 (H3-clustered histone 13) (H3-clustered histone 14) (H3-clustered histone 15) (Histone H3/m) (Histone H3/o),H3C15 HIST2H3A; H3C14 H3F2 H3FM HIST2H3C; H3C13 HIST2H3D,Homo sapiens (Human),136,H3C15
561,p48643,P48643,TCPE_HUMAN,reviewed,T-complex protein 1 subunit epsilon (TCP-1-epsilon) (EC 3.6.1.-) (CCT-epsilon) (Chaperonin containing T-complex polypeptide 1 subunit 5),CCT5 CCTE KIAA0098,Homo sapiens (Human),541,CCT5
562,p28072,P28072,PSB6_HUMAN,reviewed,Proteasome subunit beta type-6 (EC 3.4.25.1) (Macropain delta chain) (Multicatalytic endopeptidase complex delta chain) (Proteasome delta chain) (Proteasome subunit Y) (Proteasome subunit beta-1) (beta-1),PSMB6 LMPY Y,Homo sapiens (Human),239,PSMB6
563,q9nub1,Q9NUB1,ACS2L_HUMAN,reviewed,"Acetyl-coenzyme A synthetase 2-like, mitochondrial (EC 6.2.1.1) (Acetate--CoA ligase 2) (Acetyl-CoA synthetase 2) (AceCS2) (Acyl-CoA synthetase short-chain family member 1) (Propionate--CoA ligase) (EC 6.2.1.17)",ACSS1 ACAS2L KIAA1846,Homo sapiens (Human),689,ACSS1
564,q09472,Q09472,EP300_HUMAN,reviewed,Histone acetyltransferase p300 (p300 HAT) (EC 2.3.1.48) (E1A-associated protein p300) (Histone butyryltransferase p300) (EC 2.3.1.-) (Histone crotonyltransferase p300) (EC 2.3.1.-) (Protein 2-hydroxyisobutyryltransferase p300) (EC 2.3.1.-) (Protein lactyltransferas p300) (EC 2.3.1.-) (Protein propionyltransferase p300) (EC 2.3.1.-),EP300 P300,Homo sapiens (Human),2414,EP300
565,p33992,P33992,MCM5_HUMAN,reviewed,DNA replication licensing factor MCM5 (EC 3.6.4.12) (CDC46 homolog) (P1-CDC46),MCM5 CDC46,Homo sapiens (Human),734,MCM5
566,q5tka1,Q5TKA1,LIN9_HUMAN,reviewed,Protein lin-9 homolog (HuLin-9) (hLin-9) (Beta subunit-associated regulator of apoptosis) (TUDOR gene similar protein) (Type I interferon receptor beta chain-associated protein) (pRB-associated protein),LIN9 BARA TGS,Homo sapiens (Human),542,LIN9
567,a8mt69,A8MT69,CENPX_HUMAN,reviewed,Centromere protein X (CENP-X) (FANCM-associated histone fold protein 2) (FANCM-interacting histone fold protein 2) (Fanconi anemia-associated polypeptide of 10 kDa) (Retinoic acid-inducible gene D9 protein homolog) (Stimulated by retinoic acid gene 13 protein homolog),CENPX FAAP10 MHF2 STRA13,Homo sapiens (Human),81,CENPX
568,q9brj7,Q9BRJ7,TIRR_HUMAN,reviewed,Tudor-interacting repair regulator protein (NUDT16-like protein 1) (Protein syndesmos),NUDT16L1 SDOS TIRR,Homo sapiens (Human),211,NUDT16L1
569,p21580,P21580,TNAP3_HUMAN,reviewed,Tumor necrosis factor alpha-induced protein 3 (TNF alpha-induced protein 3) (EC 2.3.2.-) (EC 3.4.19.12) (OTU domain-containing protein 7C) (Putative DNA-binding protein A20) (Zinc finger protein A20) [Cleaved into: A20p50; A20p37],TNFAIP3 OTUD7C,Homo sapiens (Human),790,TNFAIP3
570,q01860,Q01860,PO5F1_HUMAN,reviewed,"POU domain, class 5, transcription factor 1 (Octamer-binding protein 3) (Oct-3) (Octamer-binding protein 4) (Oct-4) (Octamer-binding transcription factor 3) (OTF-3)",POU5F1 OCT3 OCT4 OTF3,Homo sapiens (Human),360,POU5F1
571,q6gqq9,Q6GQQ9,OTU7B_HUMAN,reviewed,OTU domain-containing protein 7B (EC 3.4.19.12) (Cellular zinc finger anti-NF-kappa-B protein) (Cezanne) (Zinc finger A20 domain-containing protein 1) (Zinc finger protein Cezanne),OTUD7B ZA20D1,Homo sapiens (Human),843,OTUD7B
572,o00268,O00268,TAF4_HUMAN,reviewed,Transcription initiation factor TFIID subunit 4 (RNA polymerase II TBP-associated factor subunit C) (TBP-associated factor 4) (Transcription initiation factor TFIID 130 kDa subunit) (TAF(II)130) (TAFII-130) (TAFII130) (Transcription initiation factor TFIID 135 kDa subunit) (TAF(II)135) (TAFII-135) (TAFII135),TAF4 TAF2C TAF2C1 TAF4A TAFII130 TAFII135,Homo sapiens (Human),1085,TAF4
573,q96ct7,Q96CT7,CC124_HUMAN,reviewed,Coiled-coil domain-containing protein 124,CCDC124,Homo sapiens (Human),223,CCDC124
574,p62495,P62495,ERF1_HUMAN,reviewed,Eukaryotic peptide chain release factor subunit 1 (Eukaryotic release factor 1) (eRF1) (Protein Cl1) (TB3-1),ETF1 ERF1 RF1 SUP45L1,Homo sapiens (Human),437,ETF1
575,p63096,P63096,GNAI1_HUMAN,reviewed,Guanine nucleotide-binding protein G(i) subunit alpha-1 (EC 3.6.5.-) (Adenylate cyclase-inhibiting G alpha protein),GNAI1,Homo sapiens (Human),354,GNAI1
576,p07305,P07305,H10_HUMAN,reviewed,"Histone H1.0 (Histone H1') (Histone H1(0)) [Cleaved into: Histone H1.0, N-terminally processed]",H1-0 H1F0 H1FV,Homo sapiens (Human),194,H1-0
577,p32780,P32780,TF2H1_HUMAN,reviewed,General transcription factor IIH subunit 1 (Basic transcription factor 2 62 kDa subunit) (BTF2 p62) (General transcription factor IIH polypeptide 1) (TFIIH basal transcription factor complex p62 subunit),GTF2H1 BTF2,Homo sapiens (Human),548,GTF2H1
578,p30260,P30260,CDC27_HUMAN,reviewed,Cell division cycle protein 27 homolog (Anaphase-promoting complex subunit 3) (APC3) (CDC27 homolog) (CDC27Hs) (H-NUC),CDC27 ANAPC3 D0S1430E D17S978E,Homo sapiens (Human),824,CDC27
579,q9h081,Q9H081,MIS12_HUMAN,reviewed,Protein MIS12 homolog,MIS12,Homo sapiens (Human),205,MIS12
580,q9bz95,Q9BZ95,NSD3_HUMAN,reviewed,Histone-lysine N-methyltransferase NSD3 (EC 2.1.1.370) (EC 2.1.1.371) (Nuclear SET domain-containing protein 3) (Protein whistle) (WHSC1-like 1 isoform 9 with methyltransferase activity to lysine) (Wolf-Hirschhorn syndrome candidate 1-like protein 1) (WHSC1-like protein 1),NSD3 WHSC1L1 DC28,Homo sapiens (Human),1437,NSD3
